index,대화0,대화1,대화2,대화3,대화4,대화5
1,..Hi,Hi. You're here..,Oh you're here. Hi.,Welcome.,Welcome. I'm waiting for you.,Welcome. I'm waiting for you.
2,It's raining..,I'm just sitting on the floor.,I ate lunch at a convenience store last time and it was worth trying. But it was a bit expensive.,When will the rain stop?,What should we do?,What should we do?
3,..Do you have anything to say to me?,I have a cramp in my leg.,You know.. Just called.,It's a nice day to meditate. So do you want to join me?,"Sweets make me feel better, but they're not good for my teeth.","Sweets make me feel better, but they're not good for my teeth."
4,..Hmm,My back is itching but I can’t scratch it.,I don‘t think I would need the sunscreen that I recently got.,"I want to feel the breeze, not the cold wind.","Sometimes I want to eat late at night, but it's not good for my health.","Sometimes I want to eat late at night, but it's not good for my health."
5,What are you looking at?,"I wish I had a smartphone, too.",Sometimes a cat comes at the window and stares at me. I have nothing to give him.,"I want to write something, but I don't know what to write.",I went to the supermarket to buy ice cream. I bought a 2-dollar-cone and ate it right away. It was really good.,I went to the supermarket to buy ice cream. I bought a 2-dollar-cone and ate it right away. It was really good.
6,..Okay,"Sometimes, I'm not sure if I'm doing well.",Sometimes a sparrow rests at the window. It seems it is trying to stay out of the rain.,"I recently got a call from a friend. It was nice to talk to him on the phone after a long time, but I had nothing to say. So we just said hello to each other.",I go for a walk every morning. I feel like getting healthier.,I go for a walk every morning. I feel like getting healthier.
7,..Why?,I can't remember what I had been up to.,I'm gaining weight since I have been eating cup noodles often lately.,The reason why there are many bugs is that it's not a bad place to live here.,I used to get lazy so I didn't eat. But now I eat 3 meals a day.,I used to get lazy so I didn't eat. But now I eat 3 meals a day.
8,*Yawn*,Why are you making that face?,I haven't been to a Korean spa for a long time. But it's not that I don't wash up.,"I went into the store to buy clothes, but I couldn't buy it with the money I had. So I just went out to look. Someday I can wear fancy clothes, right?","I don't have money to buy books, but I can borrow them from the library.","I don't have money to buy books, but I can borrow them from the library."
9,I'm tired..,I'm afraid a bug will come out when I'm sleeping.,This place was drowned when rain poured a lot in the old days. We had hard times at that time.,"I have a TV, but I can't watch much because I have to save electricity.",I want to go on a picnic to see flowers.,I want to go on a picnic to see flowers.
10,I'm sleepy..,Mold and bugs...,"I picked up coins on the street, but I've never picked up bills.","I think it's really important to communicate with people, as I'm talking to you right now.",I feel refreshed after having a good sleep.,I feel refreshed after having a good sleep.
11,When are you going to go?,*Cough*,"When I was sick, I felt sad when no one was around me. I'm used to it now.",Today the rain stopped and I saw the sunshine. But it was just my dream..,The rain will stop someday.,Sometimes I want to drink juice rather than water because it tastes good.
12,..Do you have something to say?,The room is so humid that I feel unpleasant..,I will stay at home all day tomorrow.,"After reading the newspapers last time, I got curious about the world.","Even if I don't like vegetables, I have to eat them for my health.","There are many kinds of snacks, but I don't have enough money to buy them all. And it's not good for my health if I eat them all."
13,It's raining outside..,I want to eat something but even it is a hassle to eat.,I have a cramp in my leg.,The rain will stop someday.,Sometimes I want to drink juice rather than water because it tastes good.,I saw the sunshine through the clouds.
14,Umm....,Will the rainy season ever end? Someday...,It is always hard to get up in the morning.,Sometimes outside the window seems to be a different world from here.,"There are many kinds of snacks, but I don't have enough money to buy them all. And it's not good for my health if I eat them all.",Hmm... Shall I go buy some clothes?
15,I feel stuffy in my head..,..I do not want to move.,My back is itching but I can't scratch it.,Have you ever been to my bathroom? It's better not to take a look at it.,I saw the sunshine through the clouds.,"I'm tired of buying meal. Now, I want to make it by myself."
16,(They are not thinking anything.),I will go outside when it stops raining someday.,I wish I had a smartphone.,I think caramel popcorn is the best.,Hmm... Shall I go buy some clothes?,"Come to think of it, it's not always bad to keep raining."
17,What is that..?,Will it rain in the land of umbrellas?,I don't remember how bright the sun was.,"(When our eyes met, I saw a smile for a second.) ","I'm tired of buying meal. Now, I want to make it by myself.","To be honest, I felt much better after you came."
18,..The dust is there.,Well you know.. No nothing.,I don't remember what I did when the weather was clear.,"When I woke up, there was a spider web on my body... Did the spider pass by?","Come to think of it, it's not always bad to keep raining.","When the morning comes, the birds used to sing on the window."
19,*Cough*,I want to eat sushi but I will never be able to eat.,Where is the cloud moving to?,Always think twice before you speak.,"To be honest, I felt much better after you came.","I picked up 1 dollar on the street last time. There was a vending machine next to me, so I added a little bit more to buy a drink. It wasn't bad."
20,..Boring,How bright and warm the sun must have been? I can't remember..,Will the rainy season end someday?,"There's a hole in my sock, so I need to buy a new one.","When the morning comes, the birds used to sing on the window.",I'm going to clean up tomorrow.
21,I'm lazy.,I can't remember what I had been up to when it was a bright day.,I'm lazy to move.,"Well, it's a good day, although it's raining.. ","I picked up 1 dollar on the street last time. There was a vending machine next to me, so I added a little bit more to buy a drink. It wasn't bad.",There's a 24-hour laundry shop near here. So it's really comfortable to do it.
22,I'm bored.,Where will the clouds keep flowing away?,I hate to be clammy because it rains.,I want to eat a big cotton candy.,I'm going to clean up tomorrow.,I've been stretching at home these days. I feel refreshed after doing that.
23,Umm.. No nothing.,What time is it now?,"I'm going to go outside, one day...",I want to drink a refreshing cider.,There's a 24-hour laundry shop near here. So it's really comfortable to do it.,I've been working out lately. Just breathing.
24,It is damp..,What should I do? Hmm..,I'm afraid a bug will come out when I'm sleeping.,I want to travel somewhere.,I've been stretching at home these days. I feel refreshed after doing that.,The reason why there are many bugs is that it's not a bad place to live here.
25,....Smells like old things.,It's raining outside continuously...,Umm ..hmm.,My back is itching but I can't scratch it.,I've been working out lately. Just breathing.,Hmm.. hack...! My throat tickles.
26,I'm hungry..,I'm so.. bored..,(Cute laughs) ..I didn't laugh.,I hope there is a fine dining place in my town.,The reason why there are many bugs is that it's not a bad place to live here.,How are you doing these days? I believe you're doing well.
27,I'm thirsty..,It is chilly. Is there anything to cover me?,What is that..?,"I bought a doll before, but I threw it away because it was full of mold.",Hmm.. hack...! My throat tickles.,I'll travel somewhere someday.
28,It's cold..,..My throat is a little bit sore.,I want to eat hotcakes.,"I made a big decision to buy a macaron, but I forgot to eat them. So mold started to grow. Sadly I had to throw it away.",How are you doing these days? I believe you're doing well.,"After reading the newspapers last time, I got curious about the world."
29,(They are just lost in thought.),I will never be able to eat what I want.,I want to eat a big cotton candy.,"Have you ever seen a star in the sky? In fact, I can't even see the moon.",I'll travel somewhere someday.,Have you ever been to my bathroom? It's better not to take a look at it.
30,What time is it now?,The memories of my school days are not remembered. I don't think it's important.,I want to drink a refreshing cider.,I spilled instant noodle on the bed last night. I was really sad.,"After reading the newspapers last time, I got curious about the world.",Being healthy is really good.
31,..What should I do?,(They're looking out the window.),"My body was itchy, so I looked and there was a bug. Ew...",Whether I'm a fungus or a fungus is me.,Have you ever been to my bathroom? It's better not to take a look at it.,"I think it's really important to communicate with people, as I'm talking to you right now."
32,I want to lie down on the floor.,I want to eat fruits.,I think hats don't fit well on me.,I recently saw a butterfly. It was beautiful.,Being healthy is really good.,I want to hang out with you later.
33,(They are rubbing your hands.),I think I have a cold..,I hope there's something fun.,I don‘t think I would need the sunscreen that I recently got.,"I think it's really important to communicate with people, as I'm talking to you right now.",I want to go out and eat with you later.
34,(They're looking at the floor.),(They're drawing a circle with their fingers.),I hope to sleep well at night.,Sometimes a cat comes at the window and stares at me. I have nothing to give him.,I want to hang out with you later.,I recently saw a butterfly. It was beautiful.
35,(They're looking at the ceiling.),"(When they made eye contact, their eyes returned.)",I think I'm sleepy. Hmm..,Sometimes a sparrow rests at the window. It seems it is trying to stay out of the rain.,I want to go out and eat with you later.,I think I saw a bit of sunlight today..
36,(They're looking out the window.),Spider webs..,I want to drink a cup of warm tea.,I'm gaining weight since I have been eating cup noodles often lately.,I recently saw a butterfly. It was beautiful.,It reminds me of the kid I had a crush on when I was young.
37,I'm lazy to wash my body..,(Somewhere I heard the sound of a stomach growling.),A mosquito bit my leg yesterday. It's so itchy.,I haven't been to a Korean spa for a long time so I can't remember it.,I think I saw a bit of sunlight today..,"Even if I don't like vegetables, I have to eat them for my health."
38,I ran out of tissue.,Is it cold?,I think it's more fun and better to concentrate if I make a sound while reading a book.,This place was drowned when rain poured a lot in the old days. We had hard times at that time.,It reminds me of the kid I had a crush on when I was young.,Lying down and listening to the sound of rain makes me feel at ease. It seems that I'm falling asleep when I listen to it.
39,(They are watching bugs.),How long has it been since I ate bread? I can't remember.,I want to shout at the top of my lungs on the mountains.,"(They are humming. When our eyes met, they paused. Their cheeks got blushed.)",Lying down and listening to the sound of rain makes me feel at ease. It seems that I'm falling asleep when I listen to it.,"Have you ever seen lightning? I only heard it, but I don't seem to have ever seen it."
40,I'm tired of doing nothing..,I think the room is getting smaller..,"(When our eyes met, I saw a smile for a second.)",Let me know if you're hungry. I can give you just a cup of water.,"Have you ever seen lightning? I only heard it, but I don't seem to have ever seen it.","(When we looked at each other, the staring contest began. ...I lost.)"
41,I don't have something to say...,I like instant noodles. It’s true..,(They are drawing something with their index finger on the floor.),"Someday, I want to go to a cafe and drink coffee relaxed.","(When we looked at each other, the staring contest began. ...I lost.)","It's worse if you force yourself to move when you're tired. I know you have a lot of work, but you have to rest."
42,(They are watching spider webs.),Time goes continuously...,"I remember making paper cranes when I was young. I hoped to fold 100 of them, but I only folded 10 and gave up.","Even if I don't like vegetables, I have to eat them for my health.","It's worse if you force yourself to move when you're tired. I know you have a lot of work, but you have to rest.","When I look at myself in the mirror, I feel small, but I would get better after working out."
43,I don't have anything to do..,Is the battery enough?,The sound of the rain is stronger at night.,"I can't only eat rice everytime. I want to try other foods, too.","When I look at myself in the mirror, I feel small, but I would get better after working out.","I went out at night, the streetlight was dim. I hope it's fixed soon."
44,(Somewhere I heard the sound of something scratching.),It's a meaningless time.,"These days rain water must be contaminated, Isn't it right?",It reminds me of the kid I had a crush on when I was young.,"I went out at night, the streetlight was dim. I hope it's fixed soon.",It's hard to be a precious person to someone.
45,(They are dusting off their surroundings.),I only have one pair of shoes.,It's a nice day to meditate.,(I saw them dozing off for a while and then waking up. I think I got caught laughing.) Don't laugh..,It's hard to be a precious person to someone.,"(When our eyes met, I feel they're getting close to me, not avoiding me. It's all in my head...)"
46,My clothes.. Hmm,I always buy and eat food.,"Today is the day to throw away the trash, but I'm lazy to go out and throw it away.","When I look at myself in the mirror, I feel small.","(When our eyes met, I feel they're getting close to me, not avoiding me. It's all in my head...)","I'm not good at expressing things, but I learned that it's good for each other if I open my heart and tell them honestly."
47,(They are thinking about something.),I don't like to be sticky.,I can't sleep well at night.,"When I was child, I saw the milky way and it was so beautiful. Can I see it again someday?","I'm not good at expressing things, but I learned that it's good for each other if I open my heart and tell them honestly.","I didn't desire to do anything before. I just wanted to live meaningless. But these days, I would like to try something."
48,Oh.. It's cold.,^What are you looking at now?|You|..I don't understand why you are looking at me. |Nothing |I think you are weird..,*Cough* Dust keeps going into my throat.,The children who had colorful umbrellas passed by outside. Maybe they're going on a picnic.,"I didn't desire to do anything before. I just wanted to live meaningless. But these days, I would like to try something.","(They used to cough a lot, but now it stops.)"
49,The floor feels damp.,^Do you like talking with me?|Yes|I see ..Hmm|No|Then why are you talking with me? It's weird..,There's a lot of dust on the TV.,It's good to use a hand warmer when it's cold.,"(They used to cough a lot, but now it stops.)","While sleeping, I heard the sound of grass bugs. Maybe it was raining a little. It's been a while since I heard it."
50,The time is..,^(I can feel their eyes. Shall I turn my head?)| Do it|(They made eye contact with me for a second and then looked away.) |Do not |(I'm not feeling their sight any more.),I don't want spiders to bite me.,I think I won't be bored if I have a rocking chair at home.,"While sleeping, I heard the sound of grass bugs. Maybe it was raining a little. It's been a while since I heard it.","I saw a little white puppy when I was child. He ran toward me with his tail wagging, but I was scared because he looked so big."
51,blank,blank,"If I focus on the sound of the rain, my anxieties go away.",I almost caught a cold because I ate ice cream in winter. I shouldn't eat it in the winter.,"I saw a little white puppy when I was child. He ran toward me with his tail wagging, but I was scared because he looked so big.","(I was thinking of leaving this room, but you looked happy. So I decided to stay a little longer.)"
52,blank,blank,"Sometimes, I hear rustling sounds from the ceiling.",It's really nice to feel the warmth as soon as you get home.,"(I was thinking of leaving this room, but you looked happy. So I decided to stay a little longer.)",I'm happy talking to you these days. I hope you feel the same way as I do.
53,blank,blank,I was surprised at the hit of a drop of water while sleeping. I guess the rain leaked from the ceiling.,"(They used to cough a lot, but now it stops.)",I'm happy talking to you these days. I hope you feel the same way as I do.,Better late than never. What‘s wrong with being a little late? Just the starting point is different. You never know what the result will be.
54,blank,blank,I heard a thud from the wall. I'm worried that it might collapse.,(They are looking at the window they had decorated and smiled. They seemed to be proud.),Better late than never. What‘s wrong with being a little late? Just the starting point is different. You never know what the result will be.,"I didn't wash often because I was lazy, but I take a shower really often these days. It makes me feel refreshed."
55,blank,blank,"I fall down every time I ride a bicycle, but I want to try riding it.","How long has it been since you came here? It seems to be short, but I think it's pretty long.",(They were looking out the window with no words.) Rain was pouring.,(They were looking out the window with no words.) Rain was pouring.
56,blank,blank,"As the truck passed by next to me, the room was shaking. So I thought it was an earthquake.","Honestly, there are so many things I want to do... I know that there is no such single thing to satisfy my life...","I'm starving but after taking a nap, I might feel less hungry.","I'm starving but after taking a nap, I might feel less hungry."
57,blank,blank,"I wanted to have a bird, but I don't want to lock it in a cage. I don't like being locked up either.",I didn't wash often because I was lazy.. That's bad.,"If I could go to the sauna, I want to try boiled eggs and a Korean rice drink.","If I could go to the sauna, I want to try boiled eggs and a Korean rice drink."
58,blank,blank,This place is full of dust and smell of rain.,Sometimes I imagine that I'm already full after eating something delicious to get rid of my hunger.,I've been practicing writing. I‘m getting better at it.,I've been practicing writing. I‘m getting better at it.
59,blank,blank,Mushrooms grew on the corner of the room. It doesn't seem that I can eat them.,I want to go to famous places in my country someday.,"I always bought cup noodles at the convenience store, but they had other things as well.","I always bought cup noodles at the convenience store, but they had other things as well."
60,blank,blank,It seems that there's dust in my eyes.,"If I go on a trip and buy a souvenir, I'll give it to you.",There was a claw machine game on my way home. But I skipped it since I had to save some money. I will try it next time.,There was a claw machine game on my way home. But I skipped it since I had to save some money. I will try it next time.
61,blank,blank,There's a hole in my favorite clothes. Never mind...,I've been practicing my writing recently because I have bad handwriting.,"It's better to have windows fixed. Do you remember when the windows crashed? Thinking of that makes me embarrassed,","It's better to have windows fixed. Do you remember when the windows crashed? Thinking of that makes me embarrassed,"
62,blank,blank,I always couldn't find what I needed.,I'm trying not to eat instant noodle often these days.,There are times when I read and imagine a lot. Wondering in my imaginary world is good.,There are times when I read and imagine a lot. Wondering in my imaginary world is good.
63,blank,blank,"When I was child, the sun was shining brightly, but I remember it rained a lot after the sunshine. It was so fascinating.",I can't remember where I put the tissue. Hmm...,Feels like drinking a cup of coffee or hot chocolate.,Feels like drinking a cup of coffee or hot chocolate.
64,blank,blank,"When I was 5 years old, I hit my finger on the door. I cried, but no one helped me.",Now I don't get scared when I see bugs. I guess I got used to it.,"Even if you are starving, it's better not to eat in overnight. Rather it's better to sleep through it.","Even if you are starving, it's better not to eat in overnight. Rather it's better to sleep through it."
65,blank,blank,It's good to read new books.,I think it's been a while since I've trimmed my nails. I need to trim it a bit.,Having a hot shower makes me feel better.,Having a hot shower makes me feel better.
66,blank,blank,I wish I could dry my clothes under the sun.,I recently got a call to say hello. I said I was doing well.,It's been a while since I left my home. Public transportations are getting better.,It's been a while since I left my home. Public transportations are getting better.
67,blank,blank,Sometimes I hear some kind of rustling sound from the ceiling.,I want a big and fluffy doll. I can hug it when I sleep.,I feel like singing. The sound wouldn't be heard from the rain.,Looking at a smartphone for a long time would not be good for my eyes. Taking some rest would be better.
68,blank,blank,"It's small, but it's nice to have my own room.","When I was child, I liked snow when it piled up as much as my knees. It was fun to play alone.","(They were looking at the ceiling, and when following the sight, I found a web.)",Walking around too much makes my feet hurt. Sometimes my skin gets grazed and that makes my feet hurt.
69,blank,blank,I want to eat freshly baked bread. I haven't eaten it for a long time.,I recently visited a country house and it was full of grass that was very small.,I was trying to cook but I got hurt. I want to be good at cooking soon.,"Foot is known as the heart. If you massage it well, it's good for the health."
70,blank,blank,"I believed in Santa Claus when I was child. But now, hmm...",I'm afraid to go to a hospital. It will be scary as always.,I was dreaming of flying. Then I could go above the clouds and see the sunlight.,"If I can't trust a person, I can't get the trust from the one."
71,blank,blank,I ate delicious food in my dream. I wish I had eaten everything and woke up...,My mother always patted me on the back when I woke up from a nightmare.,I was cleaning the toilet. It was tiring but felt good when it was clean.,It's better to express through words by writing or speaking than none.
72,blank,blank,"Even if there's a lot of rainwater, I can't drink it.","I opened the windows for ventilation, so I think the dust has decreased.",I want to drink some juice. It would be fresh and sweet.,"When going up or down the stairs, my knee hurts."
73,blank,blank,"(As if they are thinking about something, they have been looking out the window for a long time.)","When I was child, the country house was really spacious. I walked around with that little body.",I both like chocolate and candy. They are sweet. I feel much better when eating one of them.,"I don't have strength from my legs so if I walk too much, my legs hurt."
74,blank,blank,"When I was a kid, whenever there was thunder, I hid myself under the blanket and wanted it to pass quickly.","I used to think about when would time go, but these days, it seems time flies.",I want to dip a piece of bread in soup. I want to eat them.,Finding a life of happiness is hard.
75,blank,blank,"At important moments, I don't seem to think of anything to say.",*Cough* Dust keeps going into my throat. I need to open the window for fresh air.,It's good to read different kinds of books. I wonder what other kinds of books are there in the world.,"Since life is once, it's valuable."
76,blank,blank,I fell off from playground slide once. I fell on my back and I couldn't breathe.,The sticker I put on the window last time was cute. I'm thinking about buying it again later.,I can write things on the memo if I have them. Then I could stick them to places to see it.,There is a lot of good music out there.
77,blank,blank,The present is called present in English. Is it a gift from the past?,"The windows shook by the wind, but it's not as scary as it used to be.","If I'm sleepy, I could sleep. Sleeping is needed for life.",There are times when we are with others and times when we are alone in life.
78,blank,blank,What kind of sound does a turtle make?,Waiting is exhausting. It's the same for me and for the other person.,"^Which one is your favorite? Candy or chocolate?|Candy|Candies can be melted or bitten and eaten right away. I can eat it in various ways.|Chocolate|If I melt chocolate in my mouth, it would warm my body in this weather.","When I'm starving, my stomach rumbles."
79,blank,blank,When rain comes while the sun is up it is called sun shower. I don't think I've seen it these days.,"^Do you usually eat alone?|Yes|Me, too. | No|It's good to eat when we are with others.","^Did you see the bird fly away?|I saw it|Does it mean that the rain is less coming? I'm not sure of it.|I don't |Did I see it wrong? If I saw a bird, I think it might rain a little.",We need to be lonely sometimes. The time differs for each person.
