index,대화0,대화1,대화2,대화3,대화4,대화5
80,blank,blank,"Honestly, even if I'm sick, if I don't have someone to look after me ...I honestly think it's a bit sad.",^How is your family doing?|Good|I'm glad to hear that.| Not good|I'm sorry to hear that...,"^There's a valley I've ever visit, and it was really clean and nice. When the rain stops, why don't we go together?|Great |It'll be fun. We can have a good time, go fishing and have some delicious food.| No thanks|You don't seem to like valley. It's also good to stay at home.","When reading books, we gain knowledge."
81,blank,blank,^Is there something outside?|Nothing|It seems they are like me. hmm..|Hope|That can't be true. Funny.,^I'm hungry. What should I have? |Rice|But I'm too lazy to make it. I just want to eat instant noodle.|Noodle|I'm fed up with it. I just want to eat rice.,"^As I asked you before, do you like talking with me?|Yes|(They turned and looked at me.) Me, too. It's hard to speak up… | No|You may not like some aspects of me. But coming to meet me often means you don't hate me.","I usually read books when I'm alone, so I can concentrate well."
82,blank,blank,"^Do you have an umbrella?|No|I only have one, but take mine.|Yes|I'm glad you brought it. You're prepared.","^Have you ever traveled to other places?|Sure |You must have had a good time looking around, having delicious food, and buying souvenirs.|Nowhere |I believe that someday we can go everywhere we want.","^Do you believe your life will get better?|Yes|Me, too. As the rain stops and the sun shines, our life will be bright as well. |Definitely|Right. If you wait and persevere, it gets better.","When I'm out, it's cool and when I'm in, I feel cozy."
83,blank,blank,"^Do you know what happiness is?|Yes, I know|Tell me about it one day. I just wonder what it is.| No, I don't|I want to know about it one day.","^Which one do you like to eat, warm or cold?|Warm |When I eat warm things, I like to feel warmth spreading to my body. Just want to drink hot cocoa with marshmallows.| Cold|You can cool it down with a cold thing. Just want to take Patbingsu(Ice flakes with redbean) in the hot summer.","^Have you ever put rice cake in instant noodle?|Yes|I sometimes do. It tastes better when rice cake get mushy in instant noodle soup. | No|Then you can put other ingredients like egg, scallion in.",I once met an eye with a pigeon but it was a second. It flew away.
84,blank,blank,"^If you can correct the mistake you've done, would you do that? |Of course|Even if I could make the right decision, would it be better than the one before? It's difficult.. | Never|I have to think about it. But the first thing is that it's impossible to go back.","^Do you prefer to be alone or with anyone?|Alone|I was with you. But nowadays I changed my mind.|With someone|I think when someone is with me, I'm not scared anymore.","^It's a nice day to meditate, isn't it?| Right|So do you want to join me? Well, I'm already doing it.| Well |There might be a good day to meditate, But maybe not today.","When sitting for a long time, my back aches. It's better to stretch my back and body."
85,blank,blank,^Did you see the bug passing by my body?|Yes |Oh.. Why didn't you catch it?|No|Please catch it next time.,^How is your family doing?|Good|I'm glad to hear that. |Not good|I'm sorry to hear that..,"^Which one do you like to eat, warm or cold?|Warm|When I eat warm things, I like to feel warmth spreading to my body. Just want to drink hot cocoa with marshmallows.| Cold |You can cool it down with a cold thing. Just want to take Patbingsu(Ice flakes with redbean) in the hot summer.","When turning through the papers, we can cut fingers. So be careful."
86,blank,blank,blank,blank,blank,"When I feel the heartbeat, I feel alive."
87,blank,blank,blank,blank,blank,"When I feel frustrated, it's better to go out and feel the breeze,"
88,blank,blank,blank,blank,blank,"When muscles get stiff, it's better to make it loose."
89,blank,blank,blank,blank,blank,I hit my elbow on the edge of the table. It really hurt..
90,blank,blank,blank,blank,blank,If I could live in a dust free world then we could less clean the house. How good that would be..
91,blank,blank,blank,blank,blank,Eating vitamins are important. I can buy them outside.
92,blank,blank,blank,blank,blank,"If I want to drink cold or warm drinks, I can buy them outside."
93,blank,blank,blank,blank,blank,Sometimes there's nothing to say.
94,blank,blank,blank,blank,blank,"When talking too much, my throat dries."
95,blank,blank,blank,blank,blank,Having conversations is hard.
96,blank,blank,blank,blank,blank,I have too much dreams recently.
97,blank,blank,blank,blank,blank,"To remember what I have thought, taking notes is a good habit."
98,blank,blank,blank,blank,blank,It's getting hot when it's summer. I sweat a lot.
99,blank,blank,blank,blank,blank,Cherry blossoms are beautiful in spring.
100,blank,blank,blank,blank,blank,Trees look cold since leaves have fallen away in autumn.
101,blank,blank,blank,blank,blank,Snow falls in winter. And it gets cold...
102,blank,blank,blank,blank,blank,"When the seasons change, we have to be careful not to catch a cold."
103,blank,blank,blank,blank,blank,Sometimes it snows even in spring.
104,blank,blank,blank,blank,blank,The droning of the cicadas is the sign of summer.
105,blank,blank,blank,blank,blank,It's good to hear the ruffling sound of stepping leaves in autumn.
106,blank,blank,blank,blank,blank,"When wearing thin clothes, it would be cold."
107,blank,blank,blank,blank,blank,Turtles don't hibernate in warm places.
108,blank,blank,blank,blank,blank,I wonder how pyramids are made in the desert.
109,blank,blank,blank,blank,blank,I once saw some photos of beautiful cities. I want to go there sometime.
110,blank,blank,blank,blank,blank,There may be animals in the plain.
111,blank,blank,blank,blank,blank,"If I have work to do, then I should do it with all my best."
112,blank,blank,blank,blank,blank,(They were dozing for a second and woke up.)
113,blank,blank,blank,blank,blank,I feel like singing. The sound wouldn't be heard from the rain.
114,blank,blank,blank,blank,blank,"(They were looking at the ceiling, and when following the sight, I found a web.)"
115,blank,blank,blank,blank,blank,I was trying to cook but I got hurt. I want to be good at cooking soon.
116,blank,blank,blank,blank,blank,I was dreaming of flying. Then I could go above the clouds and see the sunlight.
117,blank,blank,blank,blank,blank,I was cleaning the toilet. It was tiring but felt good when it was clean.
118,blank,blank,blank,blank,blank,I want to drink some juice. It would be fresh and sweet.
119,blank,blank,blank,blank,blank,I both like chocolate and candy. They are sweet. I feel much better when eating one of them.
120,blank,blank,blank,blank,blank,I want to dip a piece of bread in soup. I want to eat them.
121,blank,blank,blank,blank,blank,It's good to read different kinds of books. I wonder what other kinds of books are there in the world.
122,blank,blank,blank,blank,blank,I can write things on the memo if I have them. Then I could stick them to places to see it.
123,blank,blank,blank,blank,blank,"If I'm sleepy, I could sleep. Sleeping is needed for life."
124,blank,blank,blank,blank,blank,The color of the curtains look good.
125,blank,blank,blank,blank,blank,I like the drizzling sound of the rain hitting the window. It feels like it's calling me.
126,blank,blank,blank,blank,blank,Raindrops fell through the window when I opened it to refresh the room. So I had to close them quickly..
127,blank,blank,blank,blank,blank,"When I opened the windows, a newspaper came in through the wind. But I couldn't read them since it was wet."
128,blank,blank,blank,blank,blank,"Now even if the wind blows hard, the windows don't rattle anymore."
129,blank,blank,blank,blank,blank,Do turtles like rain or not? Hmm
130,blank,blank,blank,blank,blank,I heard some turtles are fast. Would that be true?
131,blank,blank,blank,blank,blank,"One time, the turtle was not moving so I looked at it carefully but it was only sleeping."
132,blank,blank,blank,blank,blank,A turtle was about to eat a leaf of a plant. It could have been a trouble.
133,blank,blank,blank,blank,blank,(We met our eyes and did the staring contest. The turtle turned away.)
134,blank,blank,blank,blank,blank,Umbrellas should be kept in their holders.
135,blank,blank,blank,blank,blank,We need to rest after watching TV for a long time.
136,blank,blank,blank,blank,blank,Bugs pass so fast.
137,blank,blank,blank,blank,blank,Webs are everywhere. Sometimes it sticks on my face.
138,blank,blank,blank,blank,blank,Where did all the bugs go? I wonder.
139,blank,blank,blank,blank,blank,Light makes the room brighter. They are needed.
140,blank,blank,blank,blank,blank,Plants need care and patience.
141,blank,blank,blank,blank,blank,Do you have cups? They are useful for collecting rainwater.
142,blank,blank,blank,blank,blank,"It's good to sleep but if you sleep too much, it's not good for your health."
143,blank,blank,blank,blank,blank,I can see how the world goes when I read newspapers.
144,blank,blank,blank,blank,blank,"Jokes from newspapers are fun, right?"
145,blank,blank,blank,blank,blank,"When reading newspapers, I can learn four Chinese character idioms."
146,blank,blank,blank,blank,blank,The smell of paper stays longer because of rain.
147,blank,blank,blank,blank,blank,"Sometimes, the sound of rain seems like a concert for me."
148,blank,blank,blank,blank,blank,The place I live in is one small room. There's nothing more.
149,blank,blank,blank,blank,blank,It seems birds live in a world where they can freely fly since rain comes and go.
150,blank,blank,blank,blank,blank,Rain gives happiness to ones but sadness to others.
151,blank,blank,blank,blank,blank,Rains help dust go away.
152,blank,blank,blank,blank,blank,I want to eat sandwiches but there are so many vegetables.
153,blank,blank,blank,blank,blank,I want to eat chips outside.
154,blank,blank,blank,blank,blank,I remember how warm the sunshine was on me.
155,blank,blank,blank,blank,blank,I remember when I used to play outside in the rain.
156,blank,blank,blank,blank,blank,Have you seen fireflies? They seem to shine like stars. But I can't see them anymore.
157,blank,blank,blank,blank,blank,I once tapped a dog and its furs were smooth.
158,blank,blank,blank,blank,blank,"If I don't clean the room, more dust is in the room."
159,blank,blank,blank,blank,blank,"A light came through the window and when I saw it, it was moonlight through the clouds."
160,blank,blank,blank,blank,blank,Everything becomes damp after the rain. At least there's less chances of fire.
161,blank,blank,blank,blank,blank,"When thunder roars, it is scary. But I can get used to it."
162,blank,blank,blank,blank,blank,"When I lie to sleep, tucking myself under a blanket can make me have good dreams."
163,blank,blank,blank,blank,blank,I cleaned the dust from the bookshelves before you came.
164,blank,blank,blank,blank,blank,"When keeping the room pleasant, it's good for my health."
165,blank,blank,blank,blank,blank,"When I heard the noise outside the window, I saw children playing under the rain."
166,blank,blank,blank,blank,blank,"When wearing thin clothes, you can get cold. So be careful not to catch a cold."
167,blank,blank,blank,blank,blank,It's good to be healthy. So keep your health.
168,blank,blank,blank,blank,blank,(We met our eyes when I coughed.) I'm fine.
169,blank,blank,blank,blank,blank,Exercising is important. It's good to take a walk together.
170,blank,blank,blank,blank,blank,"There are different kinds of bread. There are several fillings inside. Red beans, Creams... Oh, I feel like eating them right now."
171,blank,blank,blank,blank,blank,(They were watching TV and stopped watching it.)
172,blank,blank,blank,blank,blank,"(After looking at the ceiling, they looked elsewhere.)"
173,blank,blank,blank,blank,blank,It helps to check grammar when I can read a lot of books.
174,blank,blank,blank,blank,blank,"When rain falls and eat cotton candy, the breeze of the wind can make cotton candy melt in the rain."
175,blank,blank,blank,blank,blank,Lights were out when thunder roared.
176,blank,blank,blank,blank,blank,"When I was child, I used to get scared when lights were out. In fact, I'm scared till now."
177,blank,blank,blank,blank,blank,"When it's dark, nothing can be seen. So it's frustrating."
178,blank,blank,blank,blank,blank,I used to go to the beach but I couldn't swim so I made a sandcastle.
179,blank,blank,blank,blank,blank,"When my ears are close to shells, I can hear the sound of the sea."
180,blank,blank,blank,blank,blank,The sound of the sea makes me sleep.
181,blank,blank,blank,blank,blank,"When flowers bloom, I feel good too."
182,blank,blank,blank,blank,blank,"When I was took a ride on the carousel, it was beautiful."
183,blank,blank,blank,blank,blank,"Even if I'm lazy, I need to move when I have to."
184,blank,blank,blank,blank,blank,I saw a baby when I took a walk.
185,blank,blank,blank,blank,blank,Climbing a mountain is a little hard for me.
186,blank,blank,blank,blank,blank,The night view is beautiful everytime.
187,blank,blank,blank,blank,blank,I want to see a rainbow after the rainfall.
188,blank,blank,blank,blank,blank,I have to wear a mask after the dust gets severe.
189,blank,blank,blank,blank,blank,I feel refreshed after sleeping.
190,blank,blank,blank,blank,blank,There's a lot of bees in spring. They even came into my room once.
191,blank,blank,blank,blank,blank,Newspapers are delivered right on time everyday.
192,blank,blank,blank,blank,blank,It's refreshing to drink a cup of coffee outside.
193,blank,blank,blank,blank,blank,"^Which one do you like to eat, warm or cold?|Warm|When I eat warm things, I like to feel warmth spreading to my body. Just want to drink hot cocoa with marshmallows.|Cold|You can cool it down with a cold thing. Just want to take Patbingsu(Ice flakes with redbean) in the hot summer."
194,blank,blank,blank,blank,blank,"^Did you see the bird fly away?|I saw it|Does it mean that the rain is less coming? I'm not sure of it.|I don't|Did I see it wrong? If I saw a bird, I think it might rain a little."
195,blank,blank,blank,blank,blank,"^There's a valley I've ever visit, and it was really clean and nice. When the rain stops, why don't we go together?|Great|It'll be fun. We can have a good time, go fishing and have some delicious food.|No thanks|You don't seem to like valley. It's also good to stay at home."
196,blank,blank,blank,blank,blank,"^Which one is your favorite? Candy or chocolate?| Candy|Candies can be melted or bitten and eaten right away. I can eat it in various ways.|Chocolate|If I melt chocolate in my mouth, it would warm my body in this weather."
197,blank,blank,blank,blank,blank,"^I think I should go get my hair cut. Do you want to join?|Okay|Then please help me pick a hairstyle that fits me well.|No thanks|Well, let's go together later or I can go alone."
198,blank,blank,blank,blank,blank,"^Have you ever put rice cake in instant noodle?|Yes|I sometimes do. It tastes better when rice cake get mushy in instant noodle soup.|No|Then you can put other ingredients like egg, scallion in."
199,blank,blank,blank,blank,blank,"^It's a nice day to meditate, isn't it?| Right|So do you want to join me? Well, I'm already doing it.|Well|There might be a good day to meditate, But maybe not today."
200,blank,blank,blank,blank,blank,"^Do you believe your life will get better?|Yes|Me, too. As the rain stops and the sun shines, our life will be bright as well.|Definitely|Right. If you wait and persevere, it gets better."
201,blank,blank,blank,blank,blank,"^As I asked you before, do you like talking with me?|Yes |(They turned and looked at me.) Me, too. It's hard to speak up...| No |You may not like some aspects of me. But coming to meet me often means you don't hate me."
